customer_id,name,status,phone,item_name,quantity,price,payment_method,card_number,bill_addr1,bill_addr2,state,city,zipcode,ship_charge,bill_addr1,bill_addr2,state,city,zipcode
2,"1.7 Cubic Foot Compact ""Cube"" Office Refrigerators",Barry French,293,208.16,68.02,Nunavut,Appliances,0.58,Nunavut,Appliances,GA,atlanta,100,100,Nunavut,Appliances,GA,atlanta,100
3,"Cardinal Slant-D� Ring Binder, Heavy Gauge Vinyl",Barry French,293,8.69,2.99,Nunavut,Binders and Binder Accessories,0.39,Nunavut,Binders and Binder Accessories,WA,seattle,200,200,Nunavut,Binders and Binder Accessories,WA,seattle,200
4,R380,Clay Rozendal,483,195.99,3.99,Nunavut,Telephones and Communication,0.58,Nunavut,Telephones and Communication,AZ,phoenix,300,300,Nunavut,Telephones and Communication,AZ,phoenix,300
5,Holmes HEPA Air Purifier,Carlos Soltero,515,21.78,5.94,Nunavut,Appliances,0.5,Nunavut,Appliances,TN,charlotte,400,400,Nunavut,Appliances,TN,charlotte,400
6,G.E. Longer-Life Indoor Recessed Floodlight Bulbs,Carlos Soltero,515,6.64,4.95,Nunavut,Office Furnishings,0.37,Nunavut,Office Furnishings,IL,chicago,500,500,Nunavut,Office Furnishings,IL,chicago,500
7,"Angle-D Binders with Locking Rings, Label Holders",Carl Jackson,613,7.3,7.72,Nunavut,Binders and Binder Accessories,0.38,Nunavut,Binders and Binder Accessories,AZ,phoenix,500,500,Nunavut,Binders and Binder Accessories,AZ,phoenix,500
8,"SAFCO Mobile Desk Side File, Wire Frame",Carl Jackson,613,42.76,6.22,Nunavut,Storage & Organization,0.9,Nunavut,Storage & Organization,WA,seattle,400,400,Nunavut,Storage & Organization,WA,seattle,400
9,"SAFCO Commercial Wire Shelving, Black",Monica Federle,643,138.14,35,Nunavut,Storage & Organization,0.8,Nunavut,Storage & Organization,NM,new mexico,300,300,Nunavut,Storage & Organization,NM,new mexico,300
done,Xerox 198,Dorothy Badders,678,4.98,8.33,Nunavut,Paper,0.38,Nunavut,Paper,FL,miami,200,200,Nunavut,Paper,FL,miami,200